{
  "schema_version": 1,
  "status": "active_project_compatibility_policy",
  "activation_scope": "child_project",
  "supported_versions": [
    {
      "subject": "VSN Lead Engine package",
      "supported": "0.66.1 current production package",
      "source_ref": "src/vsn_lead_engine/__init__.py",
      "consumer_scope": "repository workflows/operators"
    },
    {
      "subject": "Python runtime",
      "supported": "3.12 in CI/production workflows; project metadata remains >=3.11",
      "source_ref": "pyproject.toml + .github/workflows/*.yml",
      "consumer_scope": "GitHub Actions/runtime"
    },
    {
      "subject": "GitHub Actions dependencies",
      "supported": "reviewed immutable commit SHAs",
      "source_ref": ".github/workflows/",
      "consumer_scope": "repository automation"
    },
    {
      "subject": "ANPOS protocol",
      "supported": "1.4.0",
      "source_ref": "config/protocol/version.json",
      "consumer_scope": "repository control plane"
    }
  ],
  "deprecations": [],
  "deprecation_template": {
    "id": "DEP-0001",
    "subject": "",
    "current_version": null,
    "replacement_or_target": null,
    "announced_at": null,
    "support_until": null,
    "removal_or_eol_at": null,
    "affected_consumers": [],
    "migration_steps": [],
    "notification_refs": [],
    "exception_refs": [],
    "status": "planned"
  },
  "rules": {
    "consumer_impact_analysis_required": true,
    "approved_support_window_required_before_removal_when_material": true,
    "migration_path_required_when_replacement_exists": true,
    "expired_upstream_runtime_or_framework_support_must_be_tracked": true,
    "emergency_security_exception_requires_authenticated_authority": true
  }
}
